{
  "schemaVersion": "3.0",
  "crs": {
    "value": "PROJCS[\"North_America_Lambert_Conformal_Conic\",GEOGCS[\"NAD83\",DATUM[\"North_American_Datum_1983\",SPHEROID[\"GRS 1980\",6378137,298.257222101,AUTHORITY[\"EPSG\",\"7019\"]],AUTHORITY[\"EPSG\",\"6269\"]],PRIMEM[\"Greenwich\",0,AUTHORITY[\"EPSG\",\"8901\"]],UNIT[\"degree\",0.0174532925199433,AUTHORITY[\"EPSG\",\"9122\"]],AUTHORITY[\"EPSG\",\"4269\"]],PROJECTION[\"Lambert_Conformal_Conic_2SP\"],PARAMETER[\"latitude_of_origin\",40],PARAMETER[\"central_meridian\",-96],PARAMETER[\"standard_parallel_1\",20],PARAMETER[\"standard_parallel_2\",60],PARAMETER[\"false_easting\",0],PARAMETER[\"false_northing\",0],UNIT[\"metre\",1,AUTHORITY[\"EPSG\",\"9001\"]],AXIS[\"Easting\",EAST],AXIS[\"Northing\",NORTH],AUTHORITY[\"ESRI\",\"102009\"]]",
    "wgs84Transform": null
  },
  "extent": {
    "crsUnits": [-1971232.0326736972, -455373.8577789002, -345252.79178950447, 678242.692484039]
  },
  "view": {
    "resolutions": [1280, 640, 320, 160, 80, 40, 20],
    "defaultResolution": 80
  },
  "layers": [
    {
      "id": "digital-obstacles",
      "name": "FAA Digital Obstacles",
      "optional": true,
      "defaultVisible": false,
      "uiLabel": "Digital Obstacles (DOF)",
      "release": { "effectiveDate": "2025-01-23" },
      "zIndex": 20,
      "extent": {
        "crsUnits": [-6698991.38, -1707869.78, 4576959.89, 6243265.5]
      },
      "tile": {
        "scheme": "pmtiles",
        "tileSizePx": 512,
        "format": "mvt",
        "vectorLayerKind": "obstacles",
        "origin": [0, 0],
        "resolutions": [1280, 640, 320, 160, 80, 40, 20],
        "minResolution": 20,
        "maxResolution": 160,
        "archiveMinZoom": 2,
        "archiveMaxZoom": 9,
        "archiveUrl": "/tests/fixtures/digital-obstacle.pmtiles"
      },
      "attribution": "Federal Aviation Administration Digital Obstacle File (DOF)"
    }
  ]
}
