{
  "schemaVersion": "3.0",
  "crs": {
    "value": "PROJCS[\"North_America_Lambert_Conformal_Conic\",GEOGCS[\"NAD83\",DATUM[\"North_American_Datum_1983\",SPHEROID[\"GRS 1980\",6378137,298.257222101,AUTHORITY[\"EPSG\",\"7019\"]],AUTHORITY[\"EPSG\",\"6269\"]],PRIMEM[\"Greenwich\",0,AUTHORITY[\"EPSG\",\"8901\"]],UNIT[\"degree\",0.0174532925199433,AUTHORITY[\"EPSG\",\"9122\"]],AUTHORITY[\"EPSG\",\"4269\"]],PROJECTION[\"Lambert_Conformal_Conic_2SP\"],PARAMETER[\"latitude_of_origin\",40],PARAMETER[\"central_meridian\",-96],PARAMETER[\"standard_parallel_1\",20],PARAMETER[\"standard_parallel_2\",60],PARAMETER[\"false_easting\",0],PARAMETER[\"false_northing\",0],UNIT[\"metre\",1,AUTHORITY[\"EPSG\",\"9001\"]],AXIS[\"Easting\",EAST],AXIS[\"Northing\",NORTH],AUTHORITY[\"ESRI\",\"102009\"]]",
    "wgs84Transform": null
  },
  "extent": {
    "crsUnits": [-1971232.03, -455373.86, -345252.79, 678242.69]
  },
  "view": {
    "resolutions": [40, 20],
    "defaultResolution": 40
  },
  "layers": [
    {
      "id": "slope-shading",
      "name": "Slope Shading",
      "optional": true,
      "defaultVisible": false,
      "uiLabel": "Slope Shading",
      "zIndex": 15,
      "extent": {
        "crsUnits": [-1971232.03, -455373.86, -345252.79, 678242.69]
      },
      "tile": {
        "scheme": "pmtiles",
        "tileSizePx": 512,
        "format": "png",
        "rasterStyle": "slope-shading",
        "origin": [-1971232.03, 678242.69],
        "resolutions": [40, 20],
        "minResolution": 20,
        "maxResolution": 40,
        "archiveUrl": "/tests/fixtures/digital-obstacle.pmtiles"
      },
      "attribution": "U.S. Geological Survey"
    }
  ]
}
