{
  "schemaVersion": "3.0",
  "crs": {
    "value": "PROJCS[\"North_America_Lambert_Conformal_Conic\",GEOGCS[\"NAD83\",DATUM[\"North_American_Datum_1983\",SPHEROID[\"GRS 1980\",6378137,298.257222101,AUTHORITY[\"EPSG\",\"7019\"]],AUTHORITY[\"EPSG\",\"6269\"]],PRIMEM[\"Greenwich\",0,AUTHORITY[\"EPSG\",\"8901\"]],UNIT[\"degree\",0.0174532925199433,AUTHORITY[\"EPSG\",\"9122\"]],AUTHORITY[\"EPSG\",\"4269\"]],PROJECTION[\"Lambert_Conformal_Conic_2SP\"],PARAMETER[\"latitude_of_origin\",40],PARAMETER[\"central_meridian\",-96],PARAMETER[\"standard_parallel_1\",20],PARAMETER[\"standard_parallel_2\",60],PARAMETER[\"false_easting\",0],PARAMETER[\"false_northing\",0],UNIT[\"metre\",1,AUTHORITY[\"EPSG\",\"9001\"]],AXIS[\"Easting\",EAST],AXIS[\"Northing\",NORTH],AUTHORITY[\"ESRI\",\"102009\"]]",
    "wgs84Transform": null
  },
  "extent": {
    "crsUnits": [0, 0, 4096, 4096]
  },
  "view": {
    "resolutions": [16, 8, 4, 2],
    "defaultResolution": 4
  },
  "layers": [
    {
      "id": "vfr",
      "name": "VFR Sectionals",
      "zIndex": 0,
      "extent": {
        "crsUnits": [0, 0, 4096, 4096]
      },
      "tile": {
        "scheme": "custom-zxy",
        "tileSizePx": 512,
        "format": "webp",
        "origin": [0, 4096],
        "resolutions": [16, 8, 4, 2],
        "minResolution": 2,
        "maxResolution": 16,
        "urlTemplate": "/fixtures/tiles/vfr/{z}/{x}/{y}.webp"
      },
      "attribution": "FAA"
    },
    {
      "id": "tac",
      "name": "Terminal Area Charts",
      "zIndex": 10,
      "extent": {
        "crsUnits": [1024, 1024, 3072, 3072]
      },
      "tile": {
        "scheme": "custom-zxy",
        "tileSizePx": 512,
        "format": "webp",
        "origin": [1024, 3072],
        "resolutions": [4, 2],
        "minResolution": 2,
        "maxResolution": 4,
        "urlTemplate": "/fixtures/tiles/tac/{z}/{x}/{y}.webp"
      },
      "attribution": "FAA"
    }
  ]
}
